{
  "$schema": "../schemas/presentation-binding.schema.json",
  "schemaVersion": "1.0",
  "key": "auth.presentation.android.password-entry-start-over",
  "name": "Android Password Entry Start Over",
  "summary": "Models the UI-only navigation from Password Entry back to the authentication Welcome view without changing authentication state.",
  "version": 1,
  "maturity": "reviewed",
  "bindingKind": "ui-navigation",
  "channel": "native-ui",
  "platform": "android",
  "scenarioKeys": [],
  "actionKey": null,
  "navigationKey": "auth.navigation.password-entry.start-over",
  "authViewKey": "auth.continue.email.password",
  "route": "/auth/continue/email/password",
  "viewId": "auth.continue.email.password",
  "fieldBindings": [],
  "actionBinding": {
    "authFieldActionId": "start-over",
    "finder": "action:start-over",
    "bindingType": "navigation",
    "operationReference": null
  },
  "expectedViewId": "auth.welcome",
  "expectedRoute": "/auth/welcome",
  "sourceReferences": [
    { "sourceType": "decision", "reference": "ChatGPT conversation 2026-08-11", "note": "Password Entry keeps email editable, removes Cancel, and uses Start Over as the canonical path back to auth.welcome." }
  ]
}
