{
  "$schema": "../schemas/presentation-binding.schema.json",
  "schemaVersion": "1.0",
  "key": "auth.presentation.web.password-sign-in.locked-out",
  "name": "Web Password Sign-In Locked Out",
  "summary": "Binds a lockout-specific password sign-in result to the canonical Sign-In Locked Out surface.",
  "version": 1,
  "maturity": "reviewed",
  "bindingKind": "canonical-action",
  "channel": "web-ui",
  "platform": "web",
  "scenarioKeys": ["auth.scenario.password-sign-in.password-entry-sign-in-locked-out"],
  "actionKey": "auth.action.password-sign-in.submit",
  "navigationKey": null,
  "authViewKey": "auth.continue.email.password",
  "route": "/auth/continue/email/password",
  "viewId": "auth.continue.email.password",
  "fieldBindings": [
    { "inputKey": "password", "authViewFieldId": "password", "finder": "field:password", "bindingType": "field", "valueSource": null }
  ],
  "actionBinding": {
    "authFieldActionId": "sign-in",
    "finder": "action:sign-in",
    "bindingType": "submit",
    "operationReference": "AuthenticationFlowService.PasswordLoginAsync"
  },
  "expectedViewId": "auth.sign-in.locked-out",
  "expectedRoute": "/auth/sign-in/locked-out",
  "sourceReferences": [
    { "sourceType": "code", "reference": "softwarelogistics/nuviot-ui-shared:user/email-login-password/email-login-password.component.ts" },
    { "sourceType": "decision", "reference": "auth-model/scenarios-v2/password-sign-in/password-entry-sign-in-locked-out.json" }
  ]
}
