{
  "$schema": "../schemas/presentation-binding.schema.json",
  "schemaVersion": "1.0",
  "key": "auth.presentation.web.password-recovery.enter",
  "name": "Web Password Recovery Entry",
  "summary": "Binds the Forgot Password action on password sign-in to the canonical password recovery request surface.",
  "version": 1,
  "maturity": "reviewed",
  "bindingKind": "ui-navigation",
  "channel": "web-ui",
  "platform": "web",
  "scenarioKeys": ["auth.scenario.password-recovery.password-entry-to-reset-request"],
  "actionKey": null,
  "navigationKey": "auth.navigation.password-recovery.open-request",
  "authViewKey": "auth.continue.email.password",
  "route": "/auth/continue/email/password",
  "viewId": "auth.continue.email.password",
  "fieldBindings": [],
  "actionBinding": {
    "authFieldActionId": "forgot-password",
    "finder": "action:forgot-password",
    "bindingType": "navigation",
    "operationReference": null
  },
  "expectedViewId": "auth.password.reset.request",
  "expectedRoute": "/auth/password/reset/request",
  "sourceReferences": [
    { "sourceType": "code", "reference": "softwarelogistics/nuviot-ui-shared:user/email-login-password/email-login-password.component.ts", "note": "Implemented web password sign-in surface exposes the canonical forgot-password action." },
    { "sourceType": "decision", "reference": "auth-model/scenarios-v2/password-recovery/password-entry-to-reset-request.json" }
  ]
}
