{
  "$schema": "../schemas/presentation-binding.schema.json",
  "schemaVersion": "1.0",
  "key": "auth.presentation.web.password-recovery.complete-accepted",
  "name": "Web Password Recovery Completion Accepted",
  "summary": "Binds successful replacement-password submission to the canonical password sign-in surface.",
  "version": 1,
  "maturity": "reviewed",
  "bindingKind": "canonical-action",
  "channel": "web-ui",
  "platform": "web",
  "scenarioKeys": ["auth.scenario.password-recovery.new-password-to-sign-in"],
  "actionKey": "auth.action.recovery.complete",
  "navigationKey": null,
  "authViewKey": "auth.password.reset.complete",
  "route": "/auth/password/reset/complete",
  "viewId": "auth.password.reset.complete",
  "fieldBindings": [
    { "inputKey": "new-password", "authViewFieldId": "new-password", "finder": "field:new-password", "bindingType": "field", "valueSource": null },
    { "inputKey": "confirm-password", "authViewFieldId": "confirm-password", "finder": "field:confirm-password", "bindingType": "field", "valueSource": null }
  ],
  "actionBinding": {
    "authFieldActionId": "reset-password",
    "finder": "action:reset-password",
    "bindingType": "submit",
    "operationReference": "AuthenticationFlowService.CompletePasswordRecoveryAsync"
  },
  "expectedViewId": "auth.continue.email.password",
  "expectedRoute": "/auth/continue/email/password",
  "sourceReferences": [
    { "sourceType": "code", "reference": "softwarelogistics/nuviot-ui-shared:user/reset-password/reset-password.component.ts" },
    { "sourceType": "decision", "reference": "auth-model/scenarios-v2/password-recovery/new-password-to-sign-in.json" }
  ]
}
